country;link;text;Burial;Coffins;Pray;Washing;Food;Flowers;afterlife(Heaven or hell);Music or song
France;https://www.everyculture.com/Cr-Ga/France.html;"Religion. Religious Beliefs. France has been dominated by the influence of the Catholic Church, yet the constitution declares it to be a ""secular"" country. Secularism does not reject religion but attempts to bar any single religion from gaining political control. The minister of the interior is also the minister of religions, an office established to ensure the representation of various creeds. About 80 percent of the population is Roman Catholic. The second largest religion in terms of adherents is Islam. There are about a million Protestants; 700,000 Jews; and 200,000 Orthodox (Russian and Greek) Christians. There is also a significant Buddhist population. About 15 percent of the population claims the status of a nonbeliever. Religious practice has diminished during the last fifty years, and less than 10 percent of the population attends religious services. The dominance of Catholicism is historically linked to the conversion of Clovis in 496. In most of the country, communes began as parishes, and most rural villages see the local church building as a symbol of local identity. The church bell rings to mark deaths, wars, and weddings. French history is marked by religious struggles between Catholics and Protestants, especially during the wars of religion in the sixteenth century. Many Protestants fled during the seventeenth century, when their religious rights were rescinded by Louis XIV. The French Revolution in the eighteenth century was in part a reaction to the power and wealth of the Catholic Church. The 1905 law passed during the Third Republic officially separated church and state. The split between republicans, who supported a secular state, and antirepublicans, who were conservative and Catholic, was strong at the local level in Catholic regions such as Brittany during the turn of the century. Anti-Semitism is symbolized by the Dreyfus Affair, which was sparked at end of the nineteenth century by the false conviction for spying and imprisonment under a death sentence of a Jewish army officer. This divided republican and antirepublican factions across the nation. Anti-Semitism was prevalent during the Vichy regime and has resurfaced with the neofascist Front National. Folk religion varies by region. Witchcraft beliefs persist in some regions, such as the VendÃ©e. Many Catholic regions combine elements of folk religion and Catholicism in their belief systems. Religious Practitioners. Because of the strong influence of the Catholic Church, priests are the most important religious practitioners at the local level. France has a variety of religious practices. Immigrants bring new forms of both established and folk religious practices to urban areas. For Muslim immigrants in particular, religious practice is an important way to preserve one's identity in an assimilationist society. In rural areas, folk healers and diviners are consulted. New Age religions are thriving, and herbalists, massage healers, and other practitioners are growing in influence. Rituals and Holy Places. France was the site of many pilgrimages during the Middle Ages. Most regions have historic churches that are visited regularly on holy days, with processions leading to them. Lourdes is one of the best known pilgrimage sites in the world. Located in the Pyrenees region in the southwest, it is visited by five million people each year. In 1858, the Virgin Mary appeared to a young girl, Bernadette Soubirous, at the grotto in Lourdes. This miracle inspires handicapped and ill people to visit this site and take the waters, which are believed to have healing qualities. Lourdes has a Web site where one can hear the church bells and watch the visitors. Death and the Afterlife. The Judeo-Christian tradition dominates beliefs about the afterlife, with heaven and hell playing a major role in the cosmology. In traditional rural areas, there was a fatalist approach to death, and in many regions, such as Brittany, a ""cult"" of death â€” especially among older women. Funerals are important events, drawing from the entire community. The cemetery in France is a symbolic site of memory, often visited by older female relatives who tend to family plots. Young children often accompany grandmothers for walks through cemeteries.";1;0;0;0;0;0;1;0
Georgia;https://www.everyculture.com/Ge-It/Georgia.html;"Religion. Religious Beliefs. The great majority of the population belongs to the Georgian Orthodox Church, an Eastern (Greek) Orthodox church. Confessional Rituals and Holy Places. The great majority of Orthodox religious ceremonies are carried out by priests in churches. The most important ceremonies, especially those celebrating Easter and Christmas, are carried out by the Patriarch in Svetitskhoveli Cathedral in the ancient town of Mtskheta, or in the Zion Cathedral in Tbilisi. Daily Death and the Afterlife. Many of popular beliefs and rituals regarding death and afterlife stem from a mixture of Christian and pagan concepts, with many superstitions and cultural borrowings. Respecting the deceased is a very important part of social life, and much time is spent attending funerals and wakes and caring for graves. Although people believe in an eternal afterlife, there is no clear understanding of its nature; people observe rules and try to reduce their grief by ritualizing the mourning process.";1;0;0;0;0;0;1;0
Germany;https://www.everyculture.com/Ge-It/Germany.html;Religion. Religious Beliefs. Germany was the homeland of the Protestant Reformation, but, in the politically fragmented Holy Roman Empire of the sixteenth century, many territories remained faithful to Roman Catholicism or reverted back to it, depending of the policy of the ruling house. Today, 34 percent of the population belongs to the Evangelical (Protestant) Church and a further 34 percent belongs to the Catholic Church. Many Germans have no religious affiliation. This is especially true of former East Germany, where, in 1989, the Evangelical Church had 4 million members (out of a total population of 16.5 million) and the Catholic Church had only 921,000 members. Since 1990, the Evangelical Church has lost even more members in the new federal states. The Evangelical Church is a unified Protestant church, which combines Lutherans, Reformed Protestants, and United Protestants. Reformed Protestants adhere to a form of Calvinism, while United Protestants combine aspects of Lutheranism and Calvinism. Other Protestant denominations make up only a small fraction of the population. Most German Catholics live in the Rhineland or in southern Germany, whereas Protestants dominate in northern and central parts of the country. In 1933, there were over 500,000 people of Jewish faith or Jewish heritage living within the boundaries of the German Reich. Between 1933 and 1945, German Jews, together with members of the far more numerous Jewish populations of eastern Europe, fell victim to the anti-Semitic and genocidal policies of the National Socialists. In 1997, there are an estimated sixty-seven thousand people of Jewish faith or heritage living in Germany. The largest Jewish congregations are in Frankfurt am Main and Berlin. In the postwar era, migratory workers or immigrants from North Africa and western Asia established Islamic communities upon arriving in Germany. In 1987, there were an estimated 1.7 million Muslims living in West Germany. Religious Practitioners. Religious practitioners in Germany include especially the Protestant or Catholic pfarrer (minister or priest). In local communities, the minister or priest belongs to the publicly acknowledged group of local notables, which also includes local governmental officials, school officials, and business leaders. Roman Catholic priests are, of course, local representatives of the international church hierarchy, which is centered in Rome. Protestant ministers represent Lutheran, Reformed, or United churches, which are organized at the level of the regional states. These state-level organizations belong, in turn, to the Evangelical Church of Germany. Rituals and Holy Places. From the smallest village to the largest city, the local church dominates the central area of nearly every German settlement. German churches are often impressive architectural structures, which bear witness to centuries of growth and renovation. In predominantly Catholic areas, such as the Rhineland, Bavaria, and parts of Baden-WÃ¼rttemberg, the areas surrounding the towns and villages are typically strewn with shrines and chapels. The processions to these shrines, which were common until the late nineteenth and early twentieth centuries, have now been largely discontinued. Despite processes of secularization, which had became intensive by the early nineteenth century, churches retained their importance in public life. Beginning in the 1840s, there was a popular movement to complete the Cologne cathedral, which was begun in the Middle Ages but which remained a construction site for 400 years. With the support of the residents of Cologne, the Catholic Church, and the King of Prussia (who was a Protestant), work on the cathedral was begun in 1842 and completed in 1880. The character of the ceremonies and festivals that accompanied this process indicate that the Cologne Cathedral served not only as a church but also as a national monument. Similarly, the national assembly of 1848, in which elected representatives met to draft a constitution for a united Germany, took place in St. Paul's Church in Frankfurt. (The national and constitutional movement failed when the Prussian king refused the imperial crown, which was offered to him by the representatives of the national assembly.) One of the centers of the popular movement that led to the fall of the GDR in 1989â€“1990 was the Nikolaikirche (St. Nicolas Church) in Leipzig. Since the late nineteenth century, churches and other historical buildings in Germany have become the objects of Denkmalpflege (cultural preservation), which may be understood as one aspect of a broader culture of historical commemoration. Together with museums, historical monuments constitute a new set of special sites, which may be approached only with a correspondingly respectful attitude. Graveyards and war memorials occupy a kind of middle ground between holy sites and historical monuments. All settlements in Germany have graveyards, which surviving family members visit on special holidays or on private anniversaries. War memorials from World War I are also ubiquitous. Monuments to World War II often have a very different character. For example, the concentration camp Buchenwald, near Weimar, has, since the early 1950s, served as a commemorative site, which is dedicated to the victims of the National Socialist regime. Death and the Afterlife. Nearly 70 percent of Germans are members of a Christian church, and many of these share common Christian beliefs in himmel (heaven) and hÃ¶lle (hell) as destinations of the soul after death. Many other Germans describe themselves as agnostics or atheists, in which case they view beliefs in an afterlife as either potentially misleading or false. Funerary rites involve either a church service or a civil ceremony, depending on the beliefs of the deceased and his or her survivors.;1;0;0;0;0;0;1;0
India;https://www.everyculture.com/Ge-It/India.html;Religion. Religious Beliefs. In the 1991 census, 82 percent of the population was enumerated as Hindu. However, 12 percent of Indians are Muslim, a fact that makes this one of the largest Islamic nations in the world. The next largest religious category is Christians, who make up only over 2 percent of the population and are closely followed in number by Sikhs. The only other groups of numerical significance are the Buddhists (less than 1 percent) and the Jains (less than half a percent). Rituals and Holy Places. The thousands of rituals and millions of shrines, temples, and other holy places of many faiths defy categorization here. For Hindus, large pilgrimage temples are the holiest centers, whereas for Muslims the tombs of saints ( pir ) are the most important. For Buddhists, many of them overseas visitors, the sites associated with the Buddha are crucial. Death and the Afterlife. While Muslims, Jews, and Christians pray that their individual souls will go to a paradise after death, Hindu ideas about the afterlife are very different. Muslims, Jews, and Christians bury their dead in cemeteries, as do most Zoroastrians today. However, Zoroastrians are Most Hindu communities have a fundamental belief in reincarnation. The basic idea is that one's soul can be reincarnated for an unknown number of rebirths and that what the soul is to be reincarnated into depends on the balance of one's sins and good deeds in past lives. This belief provides the justification for the inequities of the caste system: One is born into a particular caste, whether high or low, as a result of the accumulated virtues or sins of one's soul in a previous life. One can never hope to move out of one's caste in this life but may do so in the next reincarnation. Particularly evil individuals may be reincarnated as animals. Hindus normally cremate the dead on a pile of logs, but the very poor may resort to burial. Extremely saintly figures may be buried in a sitting position, as are members of the Lingayat sect.;1;0;1;0;0;0;1;0
Italy;https://www.everyculture.com/Ge-It/Italy.html;"Religion. Religious Beliefs. Ninety percent of the population is Roman Catholic. The other 2 percent is mainly comprised of Jews, along with some Muslims and Orthodox and Eastern Rite Catholics. The general supernatural beliefs are those of the Catholic Church as mixed with some older beliefs stretching back to antiquity. In Sicily, for example, Arabic and Greek influences have mixed with popular Spanish beliefs and been incorporated into Catholicism. Religious Practitioners. Rome, or more precisely Vatican City, is the center of the Roman Catholic religion. Thus, the Pope, cardinals, bishops, monsignors, priests, members of various male and female religious orders, and others are omnipresent. The seven sacraments form a framework for religious life. Churches are plentiful and also attract the tourist dollar. There are more folkâ€“like practitioners who carry on ""magic"" or ""superstitious"" practicesâ€”various healers who may have the gift of hands, witches, purveyors of charms and spells, and many others. Rituals and Holy Places. Italy is filled with over 2000 years' worth of holy places. Rome and the Vatican City alone have thousands of shrines, relics, and churches. There are relics of Saint Peter and other popes. Various relics of many saints, places holy to Saint Francis of Assisi, shrines, places where the Virgin Mary is reputed to have appeared, and sites of numerous miracles are found across the country. Similarly, religious ceremonies are frequent. There are the usual holy days of the Roman Catholic Churchâ€”Christmas, Easter, Pentecost, the Immaculate Conception and others. In addition, there are local saints and appearances by the Pope. The sanctification of new saints, various blessings, personal, family, and regional feast days and daily and weekly masses add to the mix. There are also various novenas, rosary rituals, sodalities, men's and women's clubs, and other religious or quasiâ€“religious activities. Death and the Afterlife. Italians generally believe in a life after death in which the good are rewarded and the evil punished. There is a belief in a place where sins are purged, purgatory. Heaven and hell are realities for most Italians. The deceased are to be remembered and are often spoken to quietly. Funerals today take place in funeral parlors. Respect for the dead is expected. Failure to attend a wake for a family member or friend is cause for a breach of relationship unless there is a patently valid reason.";1;0;0;0;0;0;1;0
Mexico;https://www.everyculture.com/Ma-Ni/Mexico.html;Religion. Religious Beliefs. Roman Catholicism is the dominant religion in Mexico. After the conquest by the Spanish, Mexico's indigenous peoples readily accepted Catholic beliefs and practices, but they did so on the basis of their pre-Hispanic religious beliefs. The Virgin of Guadalupe, for example, was associated with the pagan goddess Tonantzin. As a result, Mexican folk Catholicism is frequently described as syncretic. Catholic beliefs pervade the life of ordinary Mexicans. Because the Catholic Church has been a very powerful institution in Mexican history, its relationship with the state has at times been tense and sometimes openly hostile. In recent decades, Protestant missionaries have been particularly active in southern Mexico and among the urban poor. Religious Practitioners. The most important practitioners are Catholic priests, who conduct regular masses and officiate over events Mexicans consider crucial such as birth, weddings, death, and quince aÃ±os (the initiation ceremony for girls). Priests also perform more quotidian rituals such as the blessing of new houses or cars. As parish priests are profoundly involved in the social life of local communities, their influence reaches beyond religious matters. Rituals and Holy Places. Mexico's most significant religious rituals are determined by the Catholic calendar. Easter ( Semana Santa ) is perhaps the most important of all. In different places within Mexico, the reenactment of the crucifixion of Jesus Christ on Good Friday is attended by great crowds. The largest is in Iztapalapa in Mexico City and attracts more than 100,000 believers. The nation's patron saint, the Virgin of Guadalupe, has her shrine in Mexico City, near the hill of Tepeyac, where she first appeared in 1531. The huge modern basilica there attracts hundreds of thousands of pilgrims from all over the country every year, especially on 12 December, Guadalupe's Day. Every community (rural or urban) has its own patron saint who is honored with processions and fiestas every year. Death and the Afterlife. Representations and rituals of death play a prominent role in popular culture, art, and religion. It has been suggested that this is related to pre-Columbian indigenous beliefs. Such rituals are most vigorously expressed in the festivities of the Days of the Dead, 1 and 2 November. On this occasion, Mexicans arrange altars for the dead in their homes with food, beverages, and other objects (such as skulls made of sugar or chocolate) to welcome them on their return to earth. Many Mexicans also visit churchyards and adorn the graves with large orange flowers. They will spent some time by the grave praying but also sharing memories about the deceased. The so-called Mexican cult of the dead has attracted much attention abroad.;1;0;1;0;1;1;1;0
New Zealand;https://www.everyculture.com/Ma-Ni/New-Zealand.html;Religion. Religious Beliefs. Sixteen religious sects are representedâ€”with the Anglican Church (18.4 percent) the largest, followed by Catholic (13.8 percent) and Presbyterian (13.4 percent). Twenty-six percent of the people have no religious affiliation. The Pentecostal, Buddhist, and Muslim religions have had the greatest degree of increase. Religious Practitioners. Archbishops, bishops, priests, presbyters, rabbis, imams, mullahs, elders, and pastors are office holders in New Zealand branches of worldwide churches. There is one Maori church (Ratana), and Maoridom makes wide use of the sacred-secular healing and counseling powers of the tohunga , a specialist in medicine and spirit belief. Rituals and Holy Places. Rites of the Christian calendar are observed. Cathedrals are present in every major city, and many rural areas maintain small wooden parish churches. Cemeteries are controlled by local bodies, except for Maori burial grounds. Statues of nineteenth- and early twentieth-century Pakeha public figures and war memorials are universal. Their disfigurement has become a sign of Maori protest. Waitangi has become a national memorial, as has One Tree Hill in Auckland, both marking significant events in the evolution of early Maoriâ€“European relations. Birthdays, anniversaries, and deaths may be privately or publicly commemorated. Death and the Afterlife. If embalming is not to take place, burial occurs within a day or two of death. Otherwise, funeral parlors embalm and show the body. Funeral services may be held in churches or funeral parlors. A Maori funeral ( tangi ) takes place in the marae and is a mixture of festivity and grief. Christians believe in a heaven for the afterlife (and a hell if Fundamentalist). Maori ancestors dwell after death in the ancestral lands and are;1;0;0;0;0;0;1;0
